{
  "$schema": "./schemas/workflow.schema.json",
  "schemaVersion": 1,
  "version": "2.0.0",
  "defaultProfile": "standard-product",
  "profiles": {
    "standard-product": {
      "description": "Full SDLC profile: a product baseline plus per-story feature work, with release verification.",
      "defaultChangeType": "FEATURE",
      "changeTypes": {
        "PRODUCT_BASELINE": {
          "scope": "product",
          "description": "Establish or re-baseline the product itself (discovery, requirements, PRD, architecture).",
          "gates": {
            "activation": "required",
            "discovery-ready": "required",
            "requirements-ready": "required",
            "prd-ready": "required",
            "ux-ready": "required",
            "architecture-ready": "required",
            "story-ready": "not_applicable",
            "verified": "not_applicable",
            "release-ready": "not_applicable",
            "telemetry-ready": "not_applicable",
            "iteration-ready": "not_applicable"
          }
        },
        "FEATURE": {
          "scope": "story",
          "description": "New user-visible capability traced to approved PRD acceptance criteria.",
          "gates": {
            "activation": "required",
            "discovery-ready": "not_applicable",
            "requirements-ready": "not_applicable",
            "prd-ready": "required",
            "ux-ready": "not_applicable",
            "architecture-ready": "not_applicable",
            "story-ready": "required",
            "verified": "required",
            "release-ready": "not_applicable",
            "telemetry-ready": "not_applicable",
            "iteration-ready": "not_applicable"
          }
        },
        "BUGFIX": {
          "scope": "story",
          "description": "Restore behaviour the PRD already specifies. No new acceptance criteria, so prd-ready does not re-apply.",
          "gates": {
            "activation": "required",
            "discovery-ready": "not_applicable",
            "requirements-ready": "not_applicable",
            "prd-ready": "not_applicable",
            "ux-ready": "not_applicable",
            "architecture-ready": "not_applicable",
            "story-ready": "required",
            "verified": "required",
            "release-ready": "not_applicable",
            "telemetry-ready": "not_applicable",
            "iteration-ready": "not_applicable"
          }
        },
        "SPIKE": {
          "scope": "story",
          "description": "Time-boxed investigation. Nothing here may merge into the product path; the output is a decision record.",
          "mergeable": false,
          "requiresClassificationReason": true,
          "gates": {
            "activation": "required",
            "discovery-ready": "not_applicable",
            "requirements-ready": "not_applicable",
            "prd-ready": "not_applicable",
            "ux-ready": "not_applicable",
            "architecture-ready": "not_applicable",
            "story-ready": "not_applicable",
            "verified": "not_applicable",
            "release-ready": "not_applicable",
            "telemetry-ready": "not_applicable",
            "iteration-ready": "not_applicable"
          }
        },
        "HOTFIX": {
          "scope": "story",
          "description": "Emergency production repair. story-ready is waivable under a recorded, expiring waiver; verification is never waivable.",
          "gates": {
            "activation": "required",
            "discovery-ready": "not_applicable",
            "requirements-ready": "not_applicable",
            "prd-ready": "not_applicable",
            "ux-ready": "not_applicable",
            "architecture-ready": "not_applicable",
            "story-ready": "waivable",
            "verified": "required",
            "release-ready": "not_applicable",
            "telemetry-ready": "not_applicable",
            "iteration-ready": "not_applicable"
          }
        },
        "DOC_ONLY": {
          "scope": "story",
          "description": "Documentation-only change with no product-code or behaviour impact.",
          "requiresClassificationReason": true,
          "gates": {
            "activation": "not_applicable",
            "discovery-ready": "not_applicable",
            "requirements-ready": "not_applicable",
            "prd-ready": "not_applicable",
            "ux-ready": "not_applicable",
            "architecture-ready": "not_applicable",
            "story-ready": "not_applicable",
            "verified": "not_applicable",
            "release-ready": "not_applicable",
            "telemetry-ready": "not_applicable",
            "iteration-ready": "not_applicable"
          }
        },
        "GOVERNANCE": {
          "scope": "product",
          "description": "Change to EOS itself (gates, workflow, agent map, instructions). Invalidates prior evidence by design.",
          "requiresClassificationReason": true,
          "gates": {
            "activation": "required",
            "discovery-ready": "not_applicable",
            "requirements-ready": "not_applicable",
            "prd-ready": "not_applicable",
            "ux-ready": "not_applicable",
            "architecture-ready": "not_applicable",
            "story-ready": "not_applicable",
            "verified": "not_applicable",
            "release-ready": "not_applicable",
            "telemetry-ready": "not_applicable",
            "iteration-ready": "not_applicable"
          }
        },
        "RELEASE": {
          "scope": "release",
          "description": "Promote a candidate to production.",
          "gates": {
            "activation": "required",
            "discovery-ready": "not_applicable",
            "requirements-ready": "not_applicable",
            "prd-ready": "not_applicable",
            "ux-ready": "not_applicable",
            "architecture-ready": "not_applicable",
            "story-ready": "not_applicable",
            "verified": "not_applicable",
            "release-ready": "required",
            "telemetry-ready": "required",
            "iteration-ready": "required"
          }
        }
      }
    },
    "prototype": {
      "description": "Exploration-only profile: nothing is gated except local activation. Never use it for a product that ships.",
      "defaultChangeType": "SPIKE",
      "changeTypes": {
        "SPIKE": {
          "scope": "story",
          "description": "Everything is a spike.",
          "mergeable": false,
          "requiresClassificationReason": true,
          "gates": {
            "activation": "required",
            "discovery-ready": "not_applicable",
            "requirements-ready": "not_applicable",
            "prd-ready": "not_applicable",
            "ux-ready": "not_applicable",
            "architecture-ready": "not_applicable",
            "story-ready": "not_applicable",
            "verified": "not_applicable",
            "release-ready": "not_applicable",
            "telemetry-ready": "not_applicable",
            "iteration-ready": "not_applicable"
          }
        },
        "DOC_ONLY": {
          "scope": "story",
          "description": "Documentation-only change.",
          "requiresClassificationReason": true,
          "gates": {
            "activation": "not_applicable",
            "discovery-ready": "not_applicable",
            "requirements-ready": "not_applicable",
            "prd-ready": "not_applicable",
            "ux-ready": "not_applicable",
            "architecture-ready": "not_applicable",
            "story-ready": "not_applicable",
            "verified": "not_applicable",
            "release-ready": "not_applicable",
            "telemetry-ready": "not_applicable",
            "iteration-ready": "not_applicable"
          }
        }
      }
    },
    "controlled": {
      "description": "Enterprise and business-critical systems. Everything Standard requires, plus: no gate may be waived, release verification applies to hotfixes too, and telemetry must be planned before a release is considered done. Use when an outage has customers, money or a regulator attached.",
      "defaultChangeType": "FEATURE",
      "changeTypes": {
        "PRODUCT_BASELINE": {
          "scope": "product",
          "description": "Establish or re-baseline the product itself (discovery, requirements, PRD, architecture).",
          "gates": {
            "activation": "required",
            "discovery-ready": "required",
            "requirements-ready": "required",
            "prd-ready": "required",
            "ux-ready": "required",
            "architecture-ready": "required",
            "story-ready": "not_applicable",
            "verified": "not_applicable",
            "release-ready": "not_applicable",
            "telemetry-ready": "not_applicable",
            "iteration-ready": "not_applicable"
          }
        },
        "FEATURE": {
          "scope": "story",
          "description": "New user-visible capability traced to approved PRD acceptance criteria.",
          "gates": {
            "activation": "required",
            "discovery-ready": "not_applicable",
            "requirements-ready": "not_applicable",
            "prd-ready": "required",
            "ux-ready": "not_applicable",
            "architecture-ready": "not_applicable",
            "story-ready": "required",
            "verified": "required",
            "release-ready": "not_applicable",
            "telemetry-ready": "not_applicable",
            "iteration-ready": "not_applicable"
          }
        },
        "BUGFIX": {
          "scope": "story",
          "description": "Restore behaviour the PRD already specifies. No new acceptance criteria, so prd-ready does not re-apply.",
          "gates": {
            "activation": "required",
            "discovery-ready": "not_applicable",
            "requirements-ready": "not_applicable",